{"$schema":"https://json-schema.org/draft/2020-12/schema","$id":"https://schemas.event-driven-commerce.test/events/refund-requested-v1.schema.json","title":"RefundRequestedV1","type":"object","additionalProperties":false,"required":["eventId","eventType","eventVersion","aggregateId","correlationId","causationId","occurredAt","payload"],"properties":{"eventId":{"type":"string","format":"uuid"},"eventType":{"const":"RefundRequestedV1"},"eventVersion":{"const":1},"aggregateId":{"type":"string","format":"uuid"},"correlationId":{"type":"string","format":"uuid"},"causationId":{"type":"string","format":"uuid"},"occurredAt":{"type":"string","format":"date-time"},"payload":{"type":"object","additionalProperties":false,"required":["refundId","paymentId","orderId","amount","currency","reasonCode","requestedAt"],"properties":{"refundId":{"type":"string","format":"uuid"},"paymentId":{"type":"string","format":"uuid"},"orderId":{"type":"string","format":"uuid"},"amount":{"type":"number","minimum":0},"currency":{"type":"string","pattern":"^[A-Z]{3}$"},"reasonCode":{"type":"string","pattern":"^[A-Z0-9_]{3,64}$"},"requestedAt":{"type":"string","format":"date-time"}}}}}
