{"eventId":"81000000-0000-4000-8000-000000000001","eventType":"RefundRequestedV1","eventVersion":1,"aggregateId":"82000000-0000-4000-8000-000000000001","correlationId":"83000000-0000-4000-8000-000000000001","causationId":"84000000-0000-4000-8000-000000000001","occurredAt":"2026-08-11T20:00:00Z","payload":{"refundId":"85000000-0000-4000-8000-000000000001","paymentId":"82000000-0000-4000-8000-000000000001","orderId":"86000000-0000-4000-8000-000000000001","amount":199.80,"currency":"SEK","reasonCode":"DELIVERY_FAILED","requestedAt":"2026-08-11T20:00:00Z"}}
